{
  "schemaVersion": 1,
  "revision": "4b4bc530-08ca-4d7f-9bcc-071639a97b31",
  "updatedAtMs": 1786118400000,
  "book": {
    "isbn13": "9784000000000",
    "title": "Fixture Book",
    "subtitle": null,
    "authors": ["Fixture Author"],
    "publisher": "Fixture Press",
    "publishedDate": "2026-08-08",
    "toc": "1. Fixture chapter",
    "coverUrl": null,
    "provenance": { "title": "openBD", "authors": "openBD", "publisher": "openBD", "publishedDate": "openBD", "toc": "openBD" }
  },
  "highlights": [
    {
      "id": "f82d8f9b-e173-4ef4-8f44-509f2e68f7c6",
      "quote": "Highlighted fixture text.",
      "contextBefore": "Sentence before.",
      "contextAfter": "Sentence after.",
      "pageLabel": "1",
      "chapterLabel": "1",
      "comment": "Fixture comment",
      "reviewedAtMs": 1786118400000
    }
  ]
}
